{
  "schema_version": 2,
  "protocol_version": 2,
  "artifact": "mcp/example",
  "purpose": "Configure the example artifact.",
  "platforms": ["darwin"],
  "help_urls": [
    {
      "label": "Example setup documentation",
      "url": "https://example.com/setup"
    }
  ],
  "required_tools": [],
  "capabilities": [],
  "inputs": [],
  "steps": [
    {
      "id": "restart",
      "use": "restart.notice@1",
      "with": {
        "message": "Restart the harness to activate the artifact."
      }
    }
  ]
}
